CREATEDDATE,FACILITYID,LASTUPDATEDDATE,TOURACCESSIBLE,TOURDESCRIPTION,TOURDURATION,TOURID,TOURNAME,TOURTYPE
"2014-05-02 18:31:41","233362","2016-03-03 06:26:55","No","Meet a character from Mesa Verdes past! Join a knowledgeable ranger, in costume and portraying a notable figure from Mesa Verdes past, who will guide you through Cliff Palace as the sun begins to set below the mesa top. This is a unique opportunity to learn about North Americas largest cliff dwelling through the eyes of the people who found, stabilized, and preserved it in the late 1800s and early 1900s.  <br><br> The tour is available from May 25, 2015 to September 6, 2015 on Sundays, Mondays, Tuesdays, Wednesdays, and Thursdays.","90","1","Twilight Tour","Cliff Dwelling Tour"
"2014-05-02 18:31:41","234787","2016-03-03 06:26:55","No","Observe the summer solstice amid the ancient ruins of Chimney Rock mesa.  Attendees enter the National Monument in pre-dawn darkness and meet a volunteer program leader who will escort them to two special places on Chimney Rock mesa. ","120","2","Summer Solstice","Historic Tour"
"2014-05-02 18:31:41","234638","2016-03-03 06:26:55","No","Guided tour of the Home of Franklin D. Roosevelt and a self guide tour of the FDR Presidential  Museum.","0","3","FDR Home & Mus 1 ticket (up to 25), 2 ticket (25-50)","Combo Tour"
"2014-05-02 18:31:41","233362","2016-03-03 06:26:55","No","Photographers, and those who would like to visit the famous Cliff Palace through the historical photographers lens, take this opportunity to spend 90 minutes in Cliff Palace with a park ranger in a small group setting.  On this evening tour, dramatic sunset lighting will appeal to photographers as well as those seeking a deeper connection with this extraordinary archeological treasure. Tripods and all kinds of cameras are welcome. BUT YOU MUST BE ABLE TO CARRY ALL OF YOUR GEAR WHILE KEEPING YOUR HANDS FREE TO CLIMB LADDERS. <br><br>The tour is available daily from May 27th, 2016 to September 5, 2016. Meet the ranger on the overlook above Cliff Palace at least 15 minutes in advance of the tour. Drive time to the Cliff Palace overlook from the park entrance is approximately one hour.","90","4","Twilight Photography Tour","Cliff Dwelling Tour"
"2014-05-02 18:31:41","233266","2016-03-03 06:26:55","No","Child Annual Pass","0","5","Child Annual Pass","Pass"
"2014-05-02 18:31:41","233362","2016-03-03 06:26:55","No","Yucca House National Monument is located 8 miles south of Cortez, Colorado. The large, unexcavated pueblo was probably built around AD 1200. The massive building and central location in the Montezuma Valley suggest that it was an important village. Yucca House has limited on-site parking, so tour participants will meet at the Colorado Welcome Center in Cortez and carpool to the site. A brief orientation will precede the tour. Meet the ranger at 8:00 am at the Colorado Welcome Center at 928 E. Main, Cortez, Colorado (on the corner of Mildred and Main.)<br><br>The Yucca House tour is available on Saturday May 14th, 2016 and Saturday September 10th, 2016.","180","6","Yucca House","Historic Tour"
"2014-05-02 18:31:41","233374","2016-03-03 06:26:55","Yes","Large Vehicle Parking Pass","240","7","Large Vehicle Parking Pass","Nature Tour"
"2014-05-02 18:31:41","233374","2016-03-03 06:26:55","Yes","Day Before Car Parking Pass","240","8","Day Before Parking Pass","Nature Tour"
"2014-05-02 18:31:41","233374","2016-03-03 06:26:55","Yes","Advance Parking Pass for the Firefly Event","240","9","Advance Parking Pass","Nature Tour"
"2014-05-02 18:31:41","233405","2016-03-03 06:26:55","No","Board the Borealis tour boat and cruise to historic Hoist Bay in Namakan Lake while searching for active bald eagle nests and other wildlife. Walk with a ranger for a 1/4 mile (not accessible) through the remains of an old logging camp turned resort.","150","10","Hoist Bay Tour and Eagle Watch","Boat Tour"
"2014-05-02 18:31:41","233405","2016-03-03 06:26:55","No","Voyage to the Historic Kettle Falls Hotel.  This tour takes you on a cultural and natural history tour of the park.  Spend 2 hours aboard the Borealis Tour Boat getting to the hotel. Once at the hotel spend 2 hours on land dining and touring the site and dam.  Then spend 1.5 hours on your return route.","330","11","Kettle Falls Cruise (Kabetogama Lake)","Boat Tour"
"2014-05-02 18:31:41","233405","2016-03-03 06:26:55","No","Board the Borealis and cruise Kabetogama Lake in search of active eagle nests and other wildlife. At the gardens, join a ranger for a 1/4 mile tour (not accessible) of the unique rock sculptures, building remnants, and winding paths.","120","12","Ellsworth Rock Gardens Tour and Eagle Watch","Boat Tour"
"2014-05-02 18:31:41","233405","2016-03-03 06:26:55","Yes","Uncover the truth about the 1890s Rainy Lake gold rush. View the remains of the Bushyhead mine entrance from the boat, then stretch your legs with a ranger for a short walk (accessible 1/4 mile) around Little American Island, the most productive area mine.","90","13","Gold Mine Tour","Boat Tour"
"2014-05-02 18:31:41","233405","2016-03-03 06:26:55","Yes","Discover the wonders and beauty of Voyageurs National Park.  The captain will navigate Rainy Lake in search of active eagle nests, abundant wildlife, and a historic commercial fishing camp. This tour includes a stop at Little American Island (1/4 mile accessible walk) where gold was discovered in the 1890s.","150","14","Grand Tour","Boat Tour"
"2014-05-02 18:31:41","233405","2016-03-03 06:26:55","No","Voyage to the Historic Kettle Falls Hotel.  This tour takes you on a cultural and natural history tour of the park.  Spend 2.5 hours aboard the Voyageur getting to the hotel. Once at the hotel spend 2 hours on land, dining and touring the site.  Then spend 2 hours on your return route.","390","15","Kettle Falls Cruise (Rainy Lake)","Boat Tour"
"2014-05-02 18:31:41","233338","2016-03-03 06:26:55","Yes","World War II Valor in the Pacific National Monument was established to preserve a series of sites which tell the story of the war between the U.S. and Japan in the Pacific.<br> The monument protects nine sites in three states. The Hawaii sites include Battleship Row in Pearl Harbor, the USS Arizona Memorial, the USS Oklahoma Memorial, the USS Utah Memorial and six Chief Petty Officer bungalows on Ford Island.  Pearl Harbor Memorial TheaterThe Pearl Harbor Memorial Theater is located across from the two exhibit galleries. As part of the 75-minute USS Arizona Memorial program (immediately preceding the boat trip to the actual Memorial), visitors will enter the theater to view a 23-minute documentary film on the December 7, 1941 attack.","75","16","USS Arizona Memorial","Historic Tour"
"2014-05-02 18:31:41","233338","2016-03-03 06:26:55","Yes","World War II Valor in the Pacific National Monument was established to preserve a series of sites which tell the story of the war between the U.S. and Japan in the Pacific.<br> The monument protects nine sites in three states. The Hawaii sites include Battleship Row in Pearl Harbor, the USS Arizona Memorial, the USS Oklahoma Memorial, the USS Utah Memorial and six Chief Petty Officer bungalows on Ford Island.  Pearl Harbor Memorial TheaterThe Pearl Harbor Memorial Theater is located across from the two exhibit galleries. As part of the 75-minute USS Arizona Memorial program (immediately preceding the boat trip to the actual Memorial), visitors will enter the theater to view a 23-minute documentary film on the December 7, 1941 attack.","75","17","USS Arizona Memorial Education Tour","Historic Tour"
"2014-05-02 18:31:41","233338","2016-03-03 06:26:55","Yes","A newly-updated audio tour narrated by actress Jamie Lee Curtis, daughter of actor and Pacific War veteran, Tony Curtis. The audio tour provides narration throughout the visitor center, interpretive exhibit galleries, and waterfront interpretive displays, in addition to providing interpretive information on the shuttle boats and on the Memorial. Featuring guest narration by actual Pearl Harbor Survivors and National Park Service Historian Daniel Martinez, the audio tour is recommended for all visitors waiting for their program to begin.<br><br>For visitors interested in the audio tour, headsets are available for rent at the booth to the left of the NPS Tickets and Information Desk. The audio tour is available in seven languages: English, French, Japanese, Korean, Mandarin, German, and Spanish.","0","18","Narrated Tour","Historic Tour"
"2014-05-02 18:31:41","233338","2016-03-03 06:26:55","Yes","Consider combining with your upcoming visit to the USS <i>Arizona</i> Memorial with the ability to access the Battleship <i>Missouri</i> Memorial, USS <i>Bowfin</i> Submarine Museum, and the Pacific Aviation Museum at Pearl Harbor. The USS <i>Arizona</i> Memorial does not charge a use fee, but there are charges for the Battleship <i>Missouri</i> Memorial, USS <i>Bowfin</i> Submarine Museum and Pacific Aviation Museum, which are operated by private, non-profit groups.<br><br>If you plan to visit all four of the facilities, please allow a minimum of five (5) hours for the complete Pearl Harbor experience. You may wish to allot some additional time to rest between tours, enjoy a bite to eat, and to visit our gift shops.","0","19","Passport","Historic Tour"
"2014-05-02 18:31:41","233373","2016-03-03 06:26:55","No","Birdwatching for beginners at Park locations.  Learn how to identify birds by sight and sound, along with learning habitat for resident and migratory species.","360","20","Birding in Your Parks Series: Riverbend County Park & Cascadia State Park","Nature Hike"
"2014-05-02 18:31:41","233373","2016-03-03 06:26:55","No","Follow the historic footsteps of the Kalapuya Indians along the lower floodplains of the South Santiam River.","450","21","Cascadia Cave","Cave Tour"
"2014-05-02 18:31:41","233373","2016-03-03 06:26:55","No","Explore habitat characteristics and conditions that produce the amazing array of low elevation wildflowers that return each spring. Includes wildflower identification and traditional uses of plants.","450","22","Wildflower Hike: Low Elevation Meadows & Forests","Nature Hike"
"2014-05-02 18:31:41","233373","2016-03-03 06:26:55","No","In Backpacking Basics - Field Class,  you will take the knowledge learned in the classroom session and apply it to an overnight trip.","1200","23","Backpacking Basics - Field Class ","Nature Tour"
"2014-05-02 18:31:41","233373","2016-03-03 06:26:55","No","In Backpacking Basics,  you will learn how to plan a trip, learn necessary survival skills.","400","24","Backpacking Basics - Classroom Session ","Nature Tour"
"2014-05-02 18:31:41","233373","2016-03-03 06:26:55","No","Spend two nights at Longbow Organizational Camp learning about the history, short day hikes, and preparing for the annual potluck picnic.","1200","25","Civilian and Youth Conservation Corps Outing","Nature Tour"
"2014-05-02 18:31:41","233373","2016-03-03 06:26:55","No","Explore what early travel was like in the forest on the historic toll road that once linked the Willamette Valley to eastern Oregon. Hike is mostly downhill.","480","26","Santiam Wagon Road - Snow Creek to House Rock","Historic Tour"
"2014-05-02 18:31:41","233373","2016-03-03 06:26:55","No","Enjoy a spectacular display of wildflowers, including camas and elephants-head. ","480","27","Gordon Meadows Wildflower Hike","Nature Hike"
"2014-05-02 18:31:41","233373","2016-03-03 06:26:55","No","See the moon rise from the top of Iron Mountain.  Sun and moon will be rising/setting at almost the same time on this particular day.  Discover being outdoors at night.  ","480","28","Moon Rise on Iron Mountain ","Historic Tour"
"2014-05-02 18:31:41","233373","2016-03-03 06:26:55","No","Short but steep hike through forests, meadows, and onto the top of Browder Ridge where you will have views of the Threee Sisters.  ","480","29","Wildflowers on Browder Ridge","Nature Tour"
"2014-05-02 18:31:41","233373","2016-03-03 06:26:55","No","Explore the wildflowers, panoramic views and geologic formations that surround these two landmarks. Trail is rocky and uneven in places.","480","30","Iron Mountian and Cone Peak Wildflower Hike","Nature Hike"
"2014-05-02 18:31:41","233373","2016-03-03 06:26:55","No","Explore what early travel was like in the forest on the historic toll road that once linked the Willamette Valley to eastern Oregon. Hike is mostly downhill.","480","31","Santiam Wagon Road - Fish Lake to Lost Prairie ","Nature Hike"
"2014-05-02 18:31:41","233373","2016-03-03 06:26:55","No","See the first flowers to appear once the snow melts, followed by a tour of other creatures that adorn the forest.","480","32","Early Mountain Wildflowers and Late Lichens and Mosses","Nature Hike"
"2014-05-02 18:31:41","233373","2016-03-03 06:26:55","No","Explore what early travel was like in the forest on the historic toll road that once linked the Willamette Valley to eastern Oregon. Hike is mostly downhill.","480","33","Santiam Wagon Road - Latiwi Creek to Mountain House","Historic Tour"
"2014-05-02 18:31:41","233373","2016-03-03 06:26:55","No","Explore what early travel was like in the forest on the historic toll road that once linked the Willamette Valley to eastern Oregon. Hike is mostly downhill.","0","34","Santiam Wagon Road - Tombstone Pass to Latiwi Creek via Sevenmile Hill","Nature Hike"
"2014-05-02 18:31:41","233373","2016-03-03 06:26:55","No","Bring your art supplies and a sense of adventure to have an art filled experience in the great outdoors. ","480","35","Art in Nature","Nature Hike"
"2014-05-02 18:31:41","233373","2016-03-03 06:26:55","No","Bring your art supplies and a sense of adventure to have an art filled experience in the great outdoors.","480","36","Creativity on the Edge of the Wild","Nature Hike"
"2014-05-02 18:31:41","233373","2016-03-03 06:26:55","No","Follow in the footsteps of the early packers on the forest as you walk the trails they used.","480","37","South Pyramid Creek to Shedd Camp Shelter","Historic Tour"
"2014-05-02 18:31:41","233373","2016-03-03 06:26:55","No","Walk through Fish Lake Historic site, exploring the legacy of Native Americans, Santiam Wagon Road, and 20th centrury Forest Service including all buildings and equipment from 1920-30s.","480","38","Friends of Fish Lake Tour","Nature Tour"
"2014-05-02 18:31:41","234787","2016-03-03 06:26:55","Yes","Plan to spend two hours for this guided tour as a trained volunteer tells the story of the people who lived at the Monument 1,000 years ago. The tour includes both the Pueblo trail and the Great Kiva trail. Guests will see a 44-foot diameter excavated great kiva. Also on this easy trail, theres an excavated pit house, a typical residence of the ancient ones and a sacred archeoastronomy site. The unimproved natural Pueblo trail is 1/2 mile round trip with a 200-foot elevation gain, topping out at 7,600-feet elevation. The Pueblo Trail features a multi-family dwelling and several unexcavated structures. At the top, Chimney Rocks Chacoan-style Great House Pueblo is spectacular against the backdrop of the San Juan Mountains. ","150","39","2 hour Walking Tour","Historic Tour"
"2014-05-02 18:31:41","234787","2016-03-03 06:26:55","No","The full moon program occurs against the backdrop of the Great House Pueblo at the top of Chimney Rock Mesa. The nearly 360 degree view of the mountain-studded horizon provides the dramatic celestial observatory valued so highly by the Ancient Puebloans. ","180","40","Full Moon","Historic Tour"
"2014-05-02 18:31:41","234787","2016-03-03 06:26:55","No","This program begins at the upper parking lot with a one-hour guided tour on the 1/3 mile paved Great Kiva Trail loop.","0","41","Early Tour & Full Moon Package","Combo Tour"
"2014-05-02 18:31:41","234787","2016-03-03 06:26:55","Yes","Remote from city lights, enjoy the night sky in a truly dark environment. Your evening begins with a talk at the Visitor Center amphitheater. Topics range from what the ancient people noticed in the night sky to how a telescope helps us see stars and current topics in astronomy. As darkness descends, guests drive to the High Mesa parking lot where volunteer astronomers await with telescopes to provide a closer look at the wonders of the night sky. ","210","42","Night Sky Program","Historic Tour"
"2014-05-02 18:31:41","234787","2015-01-29 05:52:20","Yes","This free program takes a particular topic and explores it in depth. Examples are the native foods eaten by the Ancestral Puebloans, their pottery, or their music and instruments.","120","43","Visions of Chimney Rock","Historic Tour"
"2014-05-02 18:31:41","234787","2016-03-03 06:26:55","No","Watch the sun rise over the San Juans this first day of autumn, and discuss how the ancients may have lived, and why they celebrated the equinoxes. This 2-3 hour event begins at the Sun Tower, a place not visited on our regular tours, and concludes at the Stone Basin providing two viewing locations.","120","44","Autumnal Equinox","Historic Tour"
"2014-05-02 18:31:41","234787","2016-03-03 06:26:55","Yes","This free, family-oriented festival is held at Chimney Rocks Visitor Center area. Step back in time as volunteers and artisans demonstrate ancient tools and crafts. ","360","45","Life at Chimney Rock","Historic Tour"
"2014-05-02 18:31:41","233338","2016-03-03 06:26:55","No","Visitors interested in a fully-narrated tour should choose this option, which includes a ticket for the USS <i>Arizona</i> Memorial program in addition to the audio tour narrated by award-winning actress Jamie Lee Curtis, daughter of actor and Pacific War veteran Tony Curtis.<br><br>The audio tour provides unique interpretation not only throughout USS <i>Arizona</i> Memorial program, but throughout the entire visitor center, including both interpretive exhibit galleries and the waterfront interpretive displays. Featuring guest narration by Pearl Harbor Survivors and National Park Service Historian Daniel Martinez, the audio tour is recommended for all visitors looking for an enhanced experience.<br><br>Audio tour headsets are available for rent at the booth to the left of the NPS Tickets and Information Desk, and the tour is available in seven languages: English, French, Japanese, Korean, Mandarin, German, and Spanish.","0","46","USS Arizona Memorial with Narrated Tour","Combo Tour"
"2014-05-02 18:31:41","233338","2016-03-03 06:26:55","No","The <b>Passport to Pearl Harbor</b> is the most popular tour and allows you to experience all four of the Pearl Harbor Historic destinations at a discounted price. Our Passport to Pearl Harbor is valid for two days within a consecutive seven-days period and includes the <b><a href= http://www.nps.gov/valr> the USS <i>Arizona</i> Memorial Narrated Tour</a></b>, and admission to <b><a href= http://www.bowfin.org> the USS <i>Bowfin</i> Submarine Museum & Park</a></b>, <b><a href= http://www.ussmissouri.com> the Battleship <i>Missouri</i> Memorial</a></b>, and <b><a href= http://www.pacificaviationmuseum.org>Pacific Aviation Museum Pearl Harbor</a></b>.  Reserved Passport to Pearl Harbor tours can be picked up at the National Park Services Ticket Desk.","0","47","Passport to Pearl Harbor","Combo Tour"
"2014-05-02 18:31:41","233338","2014-11-20 07:56:07","No","The Historic Pearl Harbor Tour is a 75 minute tour that will be onboard the Navys 150 passenger shuttle boat that will circle around Ford Island. This tour will be narrated by the NPS and will stop at the USS Arizona Memorial on the way back to the Visitor Center","75","48","Historic Pearl Harbor Tour","Historic Tour"
"2014-05-02 18:31:41","233373","2016-03-03 06:26:55","No","Enjoy the impressive fall color display of the Old Cascades.","450","49","Fall Colors & Seasonal Changes Hike","Nature Hike"
"2014-05-02 18:31:41","233373","2016-03-03 06:26:55","No","Explore native wildflowers and the volcanic landscapes that formed the Cascades on a narrated auto tour through the  District.","450","50","Wildflower Auto Tour - No Walking Necessary","Nature Tour"
"2014-05-02 18:31:41","233373","2016-03-03 06:26:55","No","Lovely hike into an Alaska yellow-cedar grove and on to a wildflower filled mountain meadow. Trail forms a loop at the upper end.","450","51","Echo Basin Wildflower Hike","Nature Hike"
"2014-05-02 18:31:41","233373","2016-03-03 06:26:55","No","This tour will visit cultural settings including open meadows, ancient trails, old growth trees, and the Edge of the World Site. Tribal practices for the past 8000 years will be discussed.","450","52","Gordon Meadows Heritage Hike","Natural and Cultural Hike"
"2014-05-02 18:31:41","234638","2016-03-03 06:26:55","No","Guided tour of the Home of Franklin D. Roosevelt and a self guide tour of the FDR Presidential  Museum. Tour of the Vanderbilt Mansion and the Eleanor Roosevelt Home.","0","53","Combo Tour Individual","Combo Tour"
"2014-05-02 18:31:41","233373","2016-03-03 06:26:55","No","Explore what early travel was like in the forest on the historic toll road that once linked the Willamette Valley to eastern Oregon.","450","54","Santiam Wagon Road Hike - Eno Road to Clear Lake","Historic Tour"
"2014-05-02 18:31:41","233373","2016-03-03 06:26:55","No","Learn about the berries that have sustained people and wildlife in the Cascades for thousands of years. Includes traditional uses of berries and how to distinguish between edible and non-edible berries. This is a great hike for families.","510","55","Berry Picking Bonanza","Nature Hike"
"2014-05-02 18:31:41","233373","2016-03-03 06:26:55","No","The exact location of the collection is not determined, but well look in the Gordon Road area and if we find some edible mushrooms, then well move the group to Longbow group camp and do a cooking demonstration.  People can bring food to share as well as their own lunch.","480","56","Fall Edible Mushrooms","Nature Hike"
"2014-05-02 18:31:41","233373","2016-03-03 06:26:55","No","Learn about proper snowshoeing technique and about the winter environment in the Cascades.  This hike is open to families; children 12 and older are welcome with adult supervision.  ","480","57","Kids Kicking It in the Snow! Snowshoe Trek","Nature Hike"
"2014-05-02 18:31:41","233373","2016-03-03 06:26:55","No","Learn about the uses of wild mushrooms, how to distinguish between edible and non-edible species; we  will collect edible mushrooms and have a cooking demonstration at Longbow in the afternoon. Bring a small collecting knife and bags/baskets.","450","58","Edible Mushroom Hike","Nature Hike"
"2014-05-02 18:31:41","233373","2016-03-03 06:26:55","No","This hike leave promptly from the ranger district office at scheduled time.  Please come prepared for a day in the forest, lunch, water, appropriate clothes, etc","450","59","Santiam Wagon Road - Burnside to Mountian House","Historic Tour"
"2014-05-02 18:31:41","233373","2016-03-03 06:26:55","No","A steep but beautiful hike. This 2 mile trail acsends 1600 feet in elevation through old growth forest and meadow before switchbacking to the summit of the Middle Pyramid. Lots of wildflowers and a spectacular view! ","510","60","Three Pyramids Wildflower Hike","Nature Hike"
"2014-05-02 18:31:41","233373","2016-03-03 06:26:55","No","Learn about the origin and identification of river rocks. Includes hiking on unmaintained trails and bending while collecting rocks.","450","61","Streamside Rock Hounding","Nature Hike"
"2014-05-02 18:31:41","233373","2016-03-03 06:26:55","No","The first half of this hike involves learning basic mushroom identification techniques with a focus on distinguishing between edible and non-edible species. Enjoy mushroom collection during the second half. A bucket or basket, and a small cutting knife are recommended. Involve climbing over logs and hiking on rocky trails. Bring waterproof boots.","450","62","Fall Mushroom Hike - Edibles & Poisonous!","Nature Hike"
"2014-05-02 18:31:41","233373","2016-03-03 06:26:55","No","Learn to assemble holiday swags and wreathes from locally collected forest products, such as boughs, cones, and berries. Some wreath rings and wire will be on hand but consider bringing more, along with clippers for trimming boughs.","450","63","Swag and Wreath Making","Outdoor Class"
"2014-05-02 18:31:41","233373","2016-03-03 06:26:55","No","Explore what early travel was like in the forest on the historic toll road that once linked the Willamette Valley to eastern Oregon. The exact route will depend on snow conditions.  Conditions can be tough, no novices please.","480","64","Winter on the Wagon Road Snowshoe Trek","Nature Hike"
"2014-05-02 18:31:41","233373","2016-03-03 06:26:55","No","Explore the cultural history, wildflowers, panoramic views and geologic formations that surround these two landmarks. Trail is rocky and uneven in places.","450","65","Iron Mountain and Cone Peak Heritage Hike","Historic Tour"
"2014-05-02 18:31:41","233373","2016-03-03 06:26:55","No","Hikers will view resource areas including hunting and gathering locations, ancient trails, a disappearing creek, and Sand Hill Crane restoration site.","450","66","Lave Lake Heritage Hike","Natural and Cultural Hike"
"2014-05-02 18:31:41","233373","2016-03-03 06:26:55","No","Birdwatching for beginners at Park locations.  Learn how to identify birds by sight and sound, along with learning habitat for resident and migratory species.","360","67","Birding in Your Parks Series - Sunnyside County Park","Nature Hike"
"2014-05-02 18:31:41","233373","2016-03-03 06:26:55","No","On this hike participants will learn how to identify common lichen and moss species found in the Cascades and why these organisms are important as environmental indicators.","450","68","Learn Your Lichens and Mosses","Nature Hike"
