CREATEDDATE,FACILITYID,LASTUPDATEDDATE,TOURACCESSIBLE,TOURDESCRIPTION,TOURDURATION,TOURID,TOURNAME,TOURTYPE
"2014-06-19 04:30:56","250795","2016-03-03 06:26:55","No","Hike: Roads Less Traveled - Bound Brook Island 8/16/14","180","163","Hike: Roads Less Traveled - Bound Brook Island 8/16/14","Nature Tour"
"2014-06-19 04:30:56","250795","2016-03-03 06:26:55","No","Fish, Snails, and Horseshoe Crab Tales: Wellfleet","90","164","Fish, Snails, and Horseshoe Crab Tales: Wellfleet","Nature Tour"
"2014-06-19 04:30:56","250795","2016-03-03 06:26:55","No","Yoga on the Beach: Eastham","75","165","Yoga on the Beach: Eastham","Nature Tour"
"2014-07-10 04:59:52","233274","2016-03-03 06:26:55","No","For the first time since its establishment as a national park site in 1908, campers seeking overnight shelter will be invited to stay the night within the walls of Mission San Jos de Tumaccori.  Camping out under the stars is a beloved tradition in national parks, says Superintendent Bob Love, We are so excited to offer visitors the chance not just to camp here at Tumaccori, but to experience this place the way travellers did over one hundred years ago.","870","166","Family Sleepover","Historic Tour"
"2014-08-28 04:37:45","234635","2014-09-11 04:20:25","No","Walk down the interior staircase of the Washington Monument (close to 900 steps) to see a new side of the worlds tallest freestanding stone structure. This is a physically challenging tour due to the nearly 50-story descent. Starting from the top of the Monument, you will step down through its layers of history and examine the staircase walls adorned with nearly 200 commemorative stones donated to the memory of the first President.","90","167","Washington Monument Staircase Tour","Historic Tour"
"2014-10-02 05:08:51","234635","2016-03-03 06:26:55","Yes","2015 Season Washington Monument","30","168","2015 Washington Monument","Historic Tour"
"2014-12-04 06:29:34","234641","2016-03-03 06:26:55","No","Overflow Tickets for the Standing Area","180","169","Overflow Tickets for the Standing Area","Historic Tour"
"2015-02-12 10:52:47","233362","2016-03-03 06:26:55","No","This 60-room site built on two ledges is one of the largest cliff dwellings in the park. Oak Tree House is a well preserved but fragile site that features plastered walls and varied architectural styles.<br><br>This tour is available from May 3rd, 2016 to May 28th, 2016 on Tuesdays and Saturdays and September 12th, 2016 to October 16th, 2016 on Mondays and Fridays. Meet the ranger for your hike at Sun Temple Overlook no later then 7:45 am. Hikers for Oak Tree House depart promptly at 8:00 am. Drive time from the park entrance is approximately one hour.","120","170","Oak Tree House","Cliff Dwelling Tour"
"2015-02-12 10:52:47","233362","2016-03-03 06:26:55","No","This short but strenuous hike leads to a stunning and surprisingly intimate cliff dwelling. Unusual aspects of this site include an original kiva roof and the Crows Nest, both features that cannot be seen from the viewpoint on the canyon rim. This tour is available May 3rd, 2015 to May 24th, 2015 on Sundays and Saturdays and September 10th, 2015 to October 18th, 2015 on Thursdays and Sundays.                                                                                                                                                                                                       ","120","171","Square Tower House","Cliff Dwelling Tour"
"2015-04-09 06:14:58","233266","2016-03-03 06:26:55","No","The Dripstone Trail Photo Tours allow for the use of time exposures, tripods, and other photo equipment. The tours provide time but not instruction for cave photography. There is no group rate for this tour.","240","172","Dripstone Trail Photo Tour","Cave Tour"
"2015-04-09 06:14:58","233266","2016-03-03 06:26:55","No","The Discovery Trail Photo Tours allow for the use of time exposures, tripods, and other photo equipment. The tours provide time but not instruction for cave photography. There is no group rate for this tour.","240","173","Discovery Trail Photo Tour","Cave Tour"
"2015-04-09 06:14:58","233362","2016-03-03 06:26:55","No","If you like both hiking and biking, this is the trip for you. This ranger-guided, 4.5 hour trek on the quieter side of Mesa Verde includes about 5 miles (8.1 km) of biking and 4 miles (6.4 km) of hiking. Expansive canyon views, spectacular overlooks of remote cliff dwellings, and a tour of magnificent Long House are all part of this adventure.<br><br>This tour is available from Wednesday, June 1st, 2016 to Sunday, September 4th, 2016 on Wednesdays and Sundays. It departs from the Wetherill Mesa parking lot. Meet the ranger at the picnic shelter by the restrooms at least 15 minutes advance. Total distance from the park entrance is 27 miles (43 km). Allow an hour and 15 minutes travel time from the park entrance. The group will leave promptly at 9:30 am.<br><br>Vehicles on this road are restricted to less than 8,000 pounds and 25-feet in length.","270","174","Wetherill Mesa Bike and Hike Adventure","Natural and Cultural Hike"
"2015-04-09 06:14:58","233373","2016-03-03 06:26:55","No","Explore what early travel was like in the forest in the historic Santiam River Area that once linked the Willamette Valley to eastern Oregon. The exact route will depend on snow conditions.  Conditions can be tough, no novices please.","480","175","Winter Snowshoe Hike on Santiam Pass ","Nature Tour"
"2015-04-09 06:14:58","233373","2016-03-03 06:26:55","No","Bring your art supplies and a sense of adventure to have an art filled experience in the great outdoors. ","480","176","Art in the Great Outdoors ","Nature Tour"
"2015-04-09 06:14:58","233373","2016-03-03 06:26:55","No","Learn skills on how to survive an outdoor emergency in Western Oregon. ","480","177","General Outdoor Preparedness","Nature Tour"
"2015-04-09 06:14:58","233373","2016-03-03 06:26:55","No","Hike through old growth Douglas-fir forest to subalpine meadows with great views of the Cascade peaks, with a side trip into Heart Lake.","480","178","Browder Ridge and Heart Lake ","Nature Tour"
"2015-05-21 06:25:00","251573","2016-03-03 06:26:55","Yes","A Guided Tour of Theodore Roosevelts Home provided park staff or a volunteer ","45","179","Guided Tour of Theodore Roosevelts Home","Historic Tour"
"2015-05-21 06:25:00","251573","2016-03-03 06:26:55","Yes","A Guided Tour of Theodore Roosevelts Home provided by park staff or a volunteer for commercial bus or other tour companies.","150","180","Commercial Group Tour of Theodore Roosevelts Home","Historic Tour"
"2015-05-21 06:25:00","251573","2015-06-25 05:19:22","Yes","A Guided Tour of Theodore Roosevelts Home provided by park staff or a volunteer","45","181","Education Tour of Theodore Roosevelts Home","Historic Tour"
"2015-06-25 05:19:22","251610","2016-03-03 06:26:55","No","Squeeze through the narrow twisting passages of the Oregon Caves. See glistening flowstone and weird hanging curtains of rock. Discover the complex geology of the Siskiyou Mountains from the inside-out. Learn about cave life and the fossils found within these marble halls. But above all, or should we say under all, come and have an adventure! ","120","182","Discovery Tour","Cave Tour"
"2015-06-25 05:19:22","251610","2016-03-03 06:26:55","No","On summer Fridays and Saturdays, the last tour of the day is conducted by candle light. This gives visitors (ages 12 and over) a chance to see what early explorers of the cave might have seen as they went from room to room with a candle.","45","183","Candlelight Cave Tour","Historic Tour"
"2015-06-25 05:19:22","251610","2016-03-03 06:26:55","No","Experience the wondrous, wild areas of Oregon Caves National Monument off trail! Trained guides will teach you caving techniques, cave etiquette, and bring you face-to-face with the marble structure of Oregon Caves. This three-hour experience through tight squeezes and crawls will challenge and exhilarate you! This is a very strenuous, adventurous experience. Scramble boulders, belly crawl, negotiate uneven rock piles, and squeeze yourself through confined cave passages as small as 11 inches by 19 inches. The only source of light is your caving headlamp!","180","184","Off-Trail Tour","Cave Tour"
"2015-09-03 03:29:30","234640","2016-03-03 06:26:55","No","Descend nearly 200 stairs at the Carmichael Entrance, pass the craggy breakdown of the Rocky Mountains and enter gypsum encrusted Cleveland Avenue. This tour showcases gypsum in various crystalline shapes and sizes. The beautifully elliptical Cleveland Avenue terminates in the Snowball Dinning Room, viewed by visitors since 1840s. Visitors retrace Cleveland Avenue, ascending nearly 200 stairs to the Carmichael Entrance. The entire route is seen on the Grand Avenue Tour. Restroom facilities and water fountains will be available in the Snowball Room. However, no food or beverages, other than water are permitted or provided.","150","185","Cleveland Avenue","Cave Tour"
"2015-09-10 07:29:04","251721","2016-03-03 06:26:55","Yes","This provides access to the Visitor Center","60","186","Visitor Center","Historic Tour"
"2015-09-10 07:29:04","251745","2016-03-03 06:26:55","Yes","Access to Rapidan Camp involves traveling on a Park-operated van on a seven-mile unpaved administrative road. For this reason, visitors must join a Ranger-guided program to travel to the site. A ranger guided tour of Rapidan Camp includes time inside both the Brown House and the Prime Ministers Cabin, as well as time exploring the grounds and gardens within the Historic Landmark. The shuttle ride is approximately 30 minutes each way. Total tour time (including travel) is 2.5 hours. Tours can be reserved up to a week in advance. Seating is limited, so early reservations are recommended. These popular programs do require some walking and standing on level ground during the tour. Many tours are accessible and can accommodate a wheelchair on the shuttle and at the site.","150","187","Accessible Wheelchair ONLY Tour","Historic Tour"
"2015-09-10 07:29:04","251745","2016-03-03 06:26:55","No","Access to Rapidan Camp involves traveling on a Park-operated van on a seven-mile unpaved administrative road. For this reason, visitors must join a Ranger-guided program to travel to the site. A ranger guided tour of Rapidan Camp includes time inside both the Brown House and the Prime Ministers Cabin, as well as time exploring the grounds and gardens within the Historic Landmark. The shuttle ride is approximately 30 minutes each way. Total tour time (including travel) is 2.5 hours. Tours can be reserved up to a week in advance. Seating is limited, so early reservations are recommended. These popular programs do require some walking and standing on level ground during the tour. Many tours are accessible and can accommodate a wheelchair on the shuttle and at the site.","150","188","Historic Rapidan Camp Tour","Historic Tour"
"2015-09-10 07:29:04","251573","2016-03-03 06:26:55","Yes","A Guided Tour of Theodore Roosevelts Home provided by park staff or a volunteer  for non-commercial educational groups from schools and other bona fide academic institutions.","150","189","Group Tour of Theodore Roosevelts Home for Educational Institutions","Historic Tour"
"2015-09-10 07:29:04","251721","2016-03-03 06:26:55","Yes","This provides access to the Memorial Plaza","45","190","Memorial Plaza","Historic Tour"
"2015-10-08 04:39:12","251610","2016-03-03 06:26:55","No","Looking for a Halloween haunt? Youll get goose-bumps on the Haunted Candlelight tour as you hear spooky stories of local history;walk amongst the bats and spiders, and discover the lesser known tales of these dark caverns.","60","191","Haunted Candlelight Tour","Cave Tour"
"2015-11-12 02:48:35","234635","2016-03-03 06:26:55","Yes","WALK-UP Washington Monument","30","192","WALK-UP Washington Monument","Historic Tour"
"2015-11-12 02:48:35","234635","2016-03-03 06:26:55","Yes","2016 Washington Monument","30","193","2016 Washington Monument","Historic Tour"
"2016-02-04 07:41:08","251853","2016-03-03 06:26:55","No",".","90","194","Grand Palace","Cave Tour"
"2016-02-04 07:41:08","251853","2016-03-03 06:26:55","Yes",".","30","195","First Room","Cave Tour"
"2016-02-04 07:41:08","251853","2016-03-03 06:26:55","No",".","60","196","Lodge Room","Cave Tour"
"2016-02-04 07:41:08","251853","2016-03-03 06:26:55","No","1st Room","0","197","Gothic Palace - Accessible","Combo Tour"
"2016-02-11 06:37:17","251898","2016-03-03 06:26:55","No","After passing through the spider web gate, your guide will give you a brief history of the Cave and point out unique features and formations. You will then be led from room to room on paved, lighted pathways, pausing to listen to the water and echoes in the Cave in total darkness.","50","198","Early Bird Tour","Cave Tour"
"2016-02-11 06:37:17","251898","2016-03-03 06:26:55","No","After passing through the spider web gate, your guide will give you a brief history of the Cave and point out unique features and formations. You will then be led from room to room on paved, lighted pathways, pausing to listen to the water and echoes in the Cave in total darkness.","50","199","Family Tour","Cave Tour"
"2016-02-11 06:37:17","251898","2016-03-03 06:26:55","No","On this tour, your child will learn about the world of cave exploration by participating in his/her own cave adventure! Young explorers will be provided with all the necessary gear- helmet, kneepads, light- before entering the Cave with two trained naturalists. The group will leave the paved trail, away from the tour lights, for a short trip to The Well that lies below the main level of Crystal Cave. Cavers must be in good physical condition, able to climb over large rocks and have no fear of small or enclosed spaces. Participants should expect to get dirty!","150","200","Junior Caver Tour","Cave Tour"
"2016-02-11 06:37:17","251898","2016-03-03 06:26:55","No","Get an in-depth experience of Crystal Caves geology and the interesting plants and animals living in and around the Cave. Participants meet their naturalist at the beginning of the trail and the group proceeds on their ecosystem exploration inside the Cave. The Cave portion of the tour is led by flashlight. Flashlights provided.","90","201","Discovery Tour","Cave Tour"
"2016-02-11 06:37:17","251898","2016-03-03 06:26:55","No","Explore off-trail, crawl, and climb through passageways, over steep drop-offs and past intricate formations on a belly-crawling tour. This tour gives you the opportunity to learn about Sierran caves first hand. Your cave guide will explain how the delicate formations such as soda straws, rimstone dams and cave pearls are formed. Experience total darkness and silence interrupted only by the rhythmic sounds of dripping and flowing water. Expect to come away with great memories, new knowledge and insight, intermingled with sore muscles and a thick coating of dirt from head to toe. All participants must be in good physical condition to participate.","270","202","Wild Cave Tour","Cave Tour"
"2016-02-11 06:37:17","251898","2016-03-03 06:26:55","No","Join our team of experienced cave naturalists for a day of spooky Halloween fun, inspired by Crystal Caves rich human history. The Cave has entertained and been loved by countless visitors since 1940. It even served as a winter home for a group of Civilian Conservation Corps workers, who were building trails inside. Of course, the Cave has hosted many explorers through the centuries, from Native peoples to National Park Service personnel. Do the spirits of these past visitors still linger and roam the Caves passageways? This tour will stop in beautiful cave rooms and along the way well meet the ghosts of Crystal Caves past.","90","203","Halloween Tour","Cave Tour"
"2016-02-25 06:22:22","233362","2016-03-03 06:26:55","No","As you hike to Spring House, you will be rewarded with views of alcove sites in Navajo and Wickiup Canyons. Spring House is the largest unexcavated cliff dwelling in the park. It has 86 rooms and seven kivas. This site is extremely fragile. You will not enter the site, but will get excellent views of the cliff dwelling from a platform built at the south end of the village.<br><br>This tour is available from Sunday May 1st, 2016 to Wednesday, May 25, 2016 on Sundays and Wednesdays and from Sunday September 11th, 2016 to Wednesday, October 12th, 2016 on Sundays and Wednesdays. Hikers depart for Spring House at 8:00 am from the Chapin Mesa Archeological Museum. Meet the ranger for your hike at least 15 minutes in advance. Drive time to the museum from the park entrance is approximately 45 minutes.","480","204","Spring House","Cliff Dwelling Tour"
"2016-02-25 06:22:22","233362","2016-03-03 06:26:55","No","Begin your day as the Ancestral Pueblo people have for generations. Climb into Balcony House as the sun rises, and step into the 21st Century of our national parks. The tour begins at the north end of the Balcony House parking lot, a 24-mile (38.6 km), 1 to 11/4 hour drive from park entrance. Meet the ranger at the benches under shade structure at Balcony House at least 15 minutes in advance of start of tour.<br><br>Dress warmly and bring a flashlight. Cameras are welcome, but you must be able to carry all of your gear while keeping your hands free to climb the ladders.<br><br>The tour is available on May 7th, June 20th, June 21st, September 21st, September 22nd, and October 10th.","90","205","Balcony House Sunrise Tour","Cliff Dwelling Tour"
